{
	"district": {
		"identifier": "MN-HennepinCo-Minneapolis-R2B",
		"name": "R2B Multiple-Family District",
		"districtType": "base",
    	"districtId": "R2B"
	},
	"last_updated": "20230815",
	"author": "OZFS Team",
	"usePermissions": {
		"permitted": ["single-family", "two-family", "three-family"]
	},
	"constraints": [
		{
			"constraintsModule": ["lotArea", "lotWidth"],
			"lot": {
				"developmentOptionalities": [
					{
						"developmentType": "primary/accessory",
			 			"bulkOptionalities": [
							{
								"bulks": ["one-family", "two-family", "three-family"],
								"lotArea": {
									"minimum": 5000,
									"maximum": 7500
								},
								"lotWidth": {
									"minimum": 40
								}
							}
						]
					}
				]
			}
		}
	]
}
